{"basePlatform":"Windows","catalogChecksum":"9415478828808919463","gameplayCatalog":{"actions":[{"actionStableId":"6b723288-2900-4598-ae3b-410dedd6210f","callableFingerprint":"16329010730896978398","name":"Play_U4_B","nameBindingRevision":"1","ownerPackStableId":"578576958633123523","providerClosureFingerprint":"833605129156681236"},{"actionStableId":"71f456a9-2af7-4ae9-bcee-bde2a56b55d3","callableFingerprint":"1122650662439991884","name":"Play_U4_Caller","nameBindingRevision":"1","ownerPackStableId":"7430552592360049291","providerClosureFingerprint":"2415833890249419664"},{"actionStableId":"7b0f599e-b17f-4a51-909d-5a5482510bde","callableFingerprint":"2359232718194222553","name":"Play_U4_Renamed","nameBindingRevision":"2","ownerPackStableId":"13000961052488402296","providerClosureFingerprint":"2830609349918064390"}],"digest":"18422616312629842101","initContentRevision":3349911899449580434,"initPackStableId":"10972495976142361935","projectId":"ec3cef40-cbb2-45ce-8e26-5310b4153a84","retired":[],"schema":2},"groups":[],"initPackStableId":"10972495976142361935","language":"","packs":[{"contentHash":"180446541400406165","contentRevision":3349911899449580434,"dependencies":[],"language":"","name":"Init","packKind":2,"packStableId":"10972495976142361935","path":"Init.pack","platformId":"229f18eb-96b3-492d-ad0a-628c8bfcfa99","variantKey":"0"},{"contentHash":"1333943567288242103","contentRevision":7785996042094735074,"dependencies":["10972495976142361935"],"language":"","name":"Play_U4_B","packKind":3,"packStableId":"578576958633123523","path":"action_6b723288-2900-4598-ae3b-410dedd6210f.pack","platformId":"229f18eb-96b3-492d-ad0a-628c8bfcfa99","variantKey":"2928516803"},{"contentHash":"729024733609875503","contentRevision":2622967677205589314,"dependencies":["10972495976142361935","578576958633123523"],"language":"","name":"Play_U4_Caller","packKind":3,"packStableId":"7430552592360049291","path":"action_71f456a9-2af7-4ae9-bcee-bde2a56b55d3.pack","platformId":"229f18eb-96b3-492d-ad0a-628c8bfcfa99","variantKey":"3363474059"},{"contentHash":"7356273533753867908","contentRevision":475166648279997614,"dependencies":["10972495976142361935"],"language":"","name":"Play_U4_Renamed","packKind":3,"packStableId":"13000961052488402296","path":"action_7b0f599e-b17f-4a51-909d-5a5482510bde.pack","platformId":"229f18eb-96b3-492d-ad0a-628c8bfcfa99","variantKey":"4165109112"}],"platformId":"229f18eb-96b3-492d-ad0a-628c8bfcfa99","platformName":"Windows","schema_version":3,"variableCatalog":{"schemaVersion":3,"projectBuildId":0,"executionCatalogFingerprint":2859494785881168858,"sdkCatalogFingerprint":4694109132088536712,"variables":[],"capacity":{"definitionCount":0,"maxReferencedPerContentPack":0,"maxVariableBindings":0,"maxStaticEmitterOverrides":0,"recommendedMaxEmitters":0,"recommendedEmitterVariableSlots":0,"recommendedPendingRows":0,"reserved":0}}}