{"basePlatform":"Windows","catalogChecksum":"5382839356192639349","gameplayCatalog":{"actions":[{"actionStableId":"77808b87-fb31-4f03-8fb0-a7a6c7b02b44","callableFingerprint":"2442426877179656715","name":"Play_U4_A","nameBindingRevision":"1","ownerPackStableId":"6544869929592501839","providerClosureFingerprint":"10957911688225933593"},{"actionStableId":"9ed810a4-76fd-4155-abc1-ab7b1f6d5cb1","callableFingerprint":"4984794131045818277","name":"Play_U4_B","nameBindingRevision":"1","ownerPackStableId":"812084374035413183","providerClosureFingerprint":"11262461348468128975"},{"actionStableId":"2b8951fd-ced8-421a-a426-f272edfc8af9","callableFingerprint":"648323603141679621","name":"Play_U4_Caller","nameBindingRevision":"1","ownerPackStableId":"12194935185640234159","providerClosureFingerprint":"2853385075389138031"}],"digest":"6688614223418649658","initContentRevision":6291040252555754727,"initPackStableId":"3729871231525534633","projectId":"2a160729-e1cb-45ec-9be9-180a6b5a1a8c","retired":[],"schema":2},"groups":[],"initPackStableId":"3729871231525534633","language":"","packs":[{"contentHash":"6565276299796371552","contentRevision":6291040252555754727,"dependencies":[],"language":"","name":"Init","packKind":2,"packStableId":"3729871231525534633","path":"Init.bytes","platformId":"b6c64d9a-5c95-4b32-8ac7-6c0962856368","variantKey":"0"},{"contentHash":"18092780963270652826","contentRevision":49147796841043068,"dependencies":["3729871231525534633"],"language":"","name":"Play_U4_B","packKind":3,"packStableId":"812084374035413183","path":"Play_U4_B.bytes","platformId":"b6c64d9a-5c95-4b32-8ac7-6c0962856368","variantKey":"2181478591"},{"contentHash":"853306455121945539","contentRevision":6307070686531431041,"dependencies":["3729871231525534633"],"language":"","name":"Play_U4_A","packKind":3,"packStableId":"6544869929592501839","path":"Play_U4_A.bytes","platformId":"b6c64d9a-5c95-4b32-8ac7-6c0962856368","variantKey":"1451177551"},{"contentHash":"10652841221122662995","contentRevision":7330058886617686957,"dependencies":["3729871231525534633","812084374035413183"],"language":"","name":"Play_U4_Caller","packKind":3,"packStableId":"12194935185640234159","path":"Play_U4_Caller.bytes","platformId":"b6c64d9a-5c95-4b32-8ac7-6c0962856368","variantKey":"2533334191"}],"platformId":"b6c64d9a-5c95-4b32-8ac7-6c0962856368","platformName":"Windows","schema_version":3,"variableCatalog":{"schemaVersion":3,"projectBuildId":0,"executionCatalogFingerprint":2859494785881168858,"sdkCatalogFingerprint":4694109132088536712,"variables":[],"capacity":{"definitionCount":0,"maxReferencedPerContentPack":0,"maxVariableBindings":0,"maxStaticEmitterOverrides":0,"recommendedMaxEmitters":0,"recommendedEmitterVariableSlots":0,"recommendedPendingRows":0,"reserved":0}}}