{"basePlatform":"Windows","catalogChecksum":"17899925850885509708","gameplayCatalog":{"actions":[{"actionStableId":"3da91a64-b947-4560-0000-000000000004","callableFingerprint":"16625703711728748585","name":"Play_Golden","nameBindingRevision":"1","ownerPackStableId":"15851618533179658462","providerClosureFingerprint":"4473815740735799085"}],"digest":"5105697509357559133","initContentRevision":6537731185061679754,"initPackStableId":"833614827603926865","projectId":"11111111-1111-1111-1111-111111111111","retired":[],"schema":2},"groups":[],"initPackStableId":"833614827603926865","language":"","packs":[{"contentHash":"4474088168416751358","contentRevision":6537731185061679754,"dependencies":[],"language":"","name":"Init","packKind":2,"packStableId":"833614827603926865","path":"Init.pack","platformId":"7e69e0e2-8d15-52df-a609-ab96fff38750","variantKey":"0"},{"contentHash":"10872779777459488934","contentRevision":5597550427143040150,"dependencies":["833614827603926865"],"language":"","name":"Play_Golden","packKind":3,"packStableId":"15851618533179658462","path":"action_3da91a64-b947-4560-0000-000000000004.pack","platformId":"7e69e0e2-8d15-52df-a609-ab96fff38750","variantKey":"153882846"}],"platformId":"7e69e0e2-8d15-52df-a609-ab96fff38750","platformName":"Windows","schema_version":3,"variableCatalog":{"schemaVersion":3,"projectBuildId":0,"executionCatalogFingerprint":2859494785881168858,"sdkCatalogFingerprint":4694109132088536712,"variables":[],"capacity":{"definitionCount":0,"maxReferencedPerContentPack":0,"maxVariableBindings":0,"maxStaticEmitterOverrides":0,"recommendedMaxEmitters":0,"recommendedEmitterVariableSlots":0,"recommendedPendingRows":0,"reserved":0}}}