{"basePlatform":"Android","catalogChecksum":"2629693064261789451","gameplayCatalog":{"actions":[{"actionStableId":"d7751bee-0c60-4c1a-aedd-f3278bfbf324","callableFingerprint":"14449752960379668282","name":"PlayTone","nameBindingRevision":"1","ownerPackStableId":"11932140826841747603","providerClosureFingerprint":"6862858462830121469"}],"digest":"3586235200886034841","initContentRevision":7648830202195497972,"initPackStableId":"10413655526410320347","projectId":"bc73664a-b4d5-464f-ab61-8e084d8f7dae","retired":[],"schema":2},"groups":[],"initPackStableId":"10413655526410320347","language":"","packs":[{"contentHash":"3525550473048988436","contentRevision":7648830202195497972,"dependencies":[],"language":"","name":"Init","packKind":2,"packStableId":"10413655526410320347","path":"Init.bytes","platformId":"62a91f00-111a-4321-a745-91c3d237ef42","variantKey":"0"},{"contentHash":"11423156245618520322","contentRevision":864100884938679271,"dependencies":["10413655526410320347"],"language":"","name":"PlayTone","packKind":3,"packStableId":"11932140826841747603","path":"PlayTone.bytes","platformId":"62a91f00-111a-4321-a745-91c3d237ef42","variantKey":"3788935315"}],"platformId":"62a91f00-111a-4321-a745-91c3d237ef42","platformName":"Android_High","schema_version":3,"variableCatalog":{"schemaVersion":3,"projectBuildId":0,"executionCatalogFingerprint":2859494785881168858,"sdkCatalogFingerprint":4694109132088536712,"variables":[],"capacity":{"definitionCount":0,"maxReferencedPerContentPack":0,"maxVariableBindings":0,"maxStaticEmitterOverrides":0,"recommendedMaxEmitters":0,"recommendedEmitterVariableSlots":0,"recommendedPendingRows":0,"reserved":0}}}