{"basePlatform":"Windows","catalogChecksum":"140416155458716797","gameplayCatalog":{"actions":[{"actionStableId":"3da91a64-b947-4560-0000-0000000186b5","callableFingerprint":"17723208711221980442","name":"Spoken","nameBindingRevision":"1","ownerPackStableId":"3821909355493901549","providerClosureFingerprint":"9840798625932949411"}],"digest":"10958373686269046230","initContentRevision":7245724876161932238,"initPackStableId":"833614827603926865","projectId":"8c4df167-627b-4e9d-afb7-d7b67b315fb5","retired":[],"schema":2},"groups":[],"initPackStableId":"833614827603926865","language":"English","packs":[{"contentHash":"18176752495724254454","contentRevision":7245724876161932238,"dependencies":[],"language":"","name":"Init","packKind":2,"packStableId":"833614827603926865","path":"Init.bytes","platformId":"7e69e0e2-8d15-52df-a609-ab96fff38750","variantKey":"0"},{"contentHash":"13061944078578354551","contentRevision":2154433079182472196,"dependencies":["833614827603926865"],"language":"English","name":"Spoken","packKind":3,"packStableId":"3821909355493901549","path":"English/Spoken.bytes","platformId":"7e69e0e2-8d15-52df-a609-ab96fff38750","variantKey":"972342509"},{"contentHash":"1098829515257731468","contentRevision":234438998047830307,"dependencies":["833614827603926865"],"language":"ja","name":"Spoken","packKind":3,"packStableId":"13930849760544921226","path":"ja/Spoken.bytes","platformId":"7e69e0e2-8d15-52df-a609-ab96fff38750","variantKey":"1688049290"}],"platformId":"7e69e0e2-8d15-52df-a609-ab96fff38750","platformName":"Windows","schema_version":3,"variableCatalog":{"schemaVersion":3,"projectBuildId":0,"executionCatalogFingerprint":2859494785881168858,"sdkCatalogFingerprint":4694109132088536712,"variables":[],"capacity":{"definitionCount":0,"maxReferencedPerContentPack":0,"maxVariableBindings":0,"maxStaticEmitterOverrides":0,"recommendedMaxEmitters":0,"recommendedEmitterVariableSlots":0,"recommendedPendingRows":0,"reserved":0}}}