{"basePlatform":"Windows","catalogChecksum":"13768885701885473971","gameplayCatalog":{"actions":[{"actionStableId":"1ffba53e-448f-447b-ac30-7f8581c993f6","callableFingerprint":"4869469141275262087","name":"Spoken","nameBindingRevision":"1","ownerPackStableId":"7925518064738856967","providerClosureFingerprint":"6892402604478600592"}],"digest":"3089889048684563575","initContentRevision":2346400836445060329,"initPackStableId":"17031476047761008865","projectId":"c6ec5c0b-d1e6-44c8-b604-e508dadb9a68","retired":[],"schema":2},"groups":[],"initPackStableId":"17031476047761008865","language":"English","packs":[{"contentHash":"4749558126902111402","contentRevision":2346400836445060329,"dependencies":[],"language":"","name":"Init","packKind":2,"packStableId":"17031476047761008865","path":"Init.bytes","platformId":"8d19c72b-d578-4bbd-8d5f-7a007e9f6f10","variantKey":"0"},{"contentHash":"8783302386031668135","contentRevision":2491906367859771615,"dependencies":["17031476047761008865"],"language":"English","name":"Spoken","packKind":3,"packStableId":"7925518064738856967","path":"English/Spoken.bytes","platformId":"8d19c72b-d578-4bbd-8d5f-7a007e9f6f10","variantKey":"1303605255"}],"platformId":"8d19c72b-d578-4bbd-8d5f-7a007e9f6f10","platformName":"Windows","schema_version":3,"variableCatalog":{"schemaVersion":3,"projectBuildId":0,"executionCatalogFingerprint":2859494785881168858,"sdkCatalogFingerprint":4694109132088536712,"variables":[],"capacity":{"definitionCount":0,"maxReferencedPerContentPack":0,"maxVariableBindings":0,"maxStaticEmitterOverrides":0,"recommendedMaxEmitters":0,"recommendedEmitterVariableSlots":0,"recommendedPendingRows":0,"reserved":0}}}