{"basePlatform":"Windows","catalogChecksum":"17976667732410260797","gameplayCatalog":{"actions":[{"actionStableId":"3da91a64-b947-4560-0000-0000000187cf","callableFingerprint":"8639866216077969446","name":"Play_Random_Draw","nameBindingRevision":"1","ownerPackStableId":"7929627108153572037","providerClosureFingerprint":"13492353636221153196"},{"actionStableId":"3da91a64-b947-4560-0000-0000000187e3","callableFingerprint":"16272109333536616750","name":"Play_Random_Queue","nameBindingRevision":"1","ownerPackStableId":"7931547954967678204","providerClosureFingerprint":"7974697012319185925"},{"actionStableId":"3da91a64-b947-4560-0000-0000000187ed","callableFingerprint":"2122601454808396074","name":"Play_Sequence","nameBindingRevision":"1","ownerPackStableId":"7931599632014204121","providerClosureFingerprint":"13309986660687316789"},{"actionStableId":"3da91a64-b947-4560-0000-0000000187f7","callableFingerprint":"16828477431682473398","name":"Play_Sequence_Queue","nameBindingRevision":"1","ownerPackStableId":"7932546311525904567","providerClosureFingerprint":"3932542023723905253"},{"actionStableId":"3da91a64-b947-4560-0000-0000000187d9","callableFingerprint":"12923533888985861727","name":"Play_Shuffle","nameBindingRevision":"1","ownerPackStableId":"7930569389618759639","providerClosureFingerprint":"17281130895721486684"},{"actionStableId":"3da91a64-b947-4560-0000-000000018801","callableFingerprint":"14093576875165068400","name":"Play_Variable_Control","nameBindingRevision":"1","ownerPackStableId":"7317907216890778746","providerClosureFingerprint":"7122942377638241962"}],"digest":"9952584208983679576","initContentRevision":1847293282175913138,"initPackStableId":"833614827603926865","projectId":"2c2ed2ff-33b0-4940-af9e-b1d174612e2b","retired":[],"schema":2},"groups":[],"initPackStableId":"833614827603926865","language":"","packs":[{"contentHash":"4016487068330113005","contentRevision":1847293282175913138,"dependencies":[],"language":"","name":"Init","packKind":2,"packStableId":"833614827603926865","path":"Init.bytes","platformId":"7e69e0e2-8d15-52df-a609-ab96fff38750","variantKey":"0"},{"contentHash":"46186681588397733","contentRevision":3177781116518543370,"dependencies":["833614827603926865"],"language":"","name":"Play_Variable_Control","packKind":3,"packStableId":"7317907216890778746","path":"Play_Variable_Control.bytes","platformId":"7e69e0e2-8d15-52df-a609-ab96fff38750","variantKey":"2181747834"},{"contentHash":"9299151827193365196","contentRevision":6817808188398894200,"dependencies":["833614827603926865"],"language":"","name":"Play_Random_Draw","packKind":3,"packStableId":"7929627108153572037","path":"Play_Random_Draw.bytes","platformId":"7e69e0e2-8d15-52df-a609-ab96fff38750","variantKey":"2261596869"},{"contentHash":"18274018242588347717","contentRevision":534194077089120870,"dependencies":["833614827603926865"],"language":"","name":"Play_Shuffle","packKind":3,"packStableId":"7930569389618759639","path":"Play_Shuffle.bytes","platformId":"7e69e0e2-8d15-52df-a609-ab96fff38750","variantKey":"2261780439"},{"contentHash":"12568108995248633679","contentRevision":160710491629234690,"dependencies":["833614827603926865"],"language":"","name":"Play_Random_Queue","packKind":3,"packStableId":"7931547954967678204","path":"Play_Random_Queue.bytes","platformId":"7e69e0e2-8d15-52df-a609-ab96fff38750","variantKey":"2261978364"},{"contentHash":"9661805392319907606","contentRevision":5822057496149677502,"dependencies":["833614827603926865"],"language":"","name":"Play_Sequence","packKind":3,"packStableId":"7931599632014204121","path":"Play_Sequence.bytes","platformId":"7e69e0e2-8d15-52df-a609-ab96fff38750","variantKey":"2261998809"},{"contentHash":"13726304483406458468","contentRevision":2260288674851520912,"dependencies":["833614827603926865"],"language":"","name":"Play_Sequence_Queue","packKind":3,"packStableId":"7932546311525904567","path":"Play_Sequence_Queue.bytes","platformId":"7e69e0e2-8d15-52df-a609-ab96fff38750","variantKey":"2262184119"}],"platformId":"7e69e0e2-8d15-52df-a609-ab96fff38750","platformName":"Windows","schema_version":3,"variableCatalog":{"schemaVersion":3,"projectBuildId":0,"executionCatalogFingerprint":13806646261371859538,"sdkCatalogFingerprint":10553520479437889524,"variables":[{"variableId":"3da91a64-b947-4560-0000-00000001876b","kind":0,"scopePolicy":1,"writers":1,"rangeMinBits":0,"rangeMaxBits":1065353216,"defaultBits":0,"executionFingerprint":10941074716209232590,"codeName":"Demo_Choice","displayName":"Demo_Choice","description":"","unit":"","precision":0,"displayScale":0,"deprecated":0,"replacementId":"00000000-0000-0000-0000-000000000000","labels":[],"ownerInitPackId":833614827603926865}],"capacity":{"definitionCount":1,"maxReferencedPerContentPack":0,"maxVariableBindings":0,"maxStaticEmitterOverrides":0,"recommendedMaxEmitters":0,"recommendedEmitterVariableSlots":0,"recommendedPendingRows":0,"reserved":0}}}