{"basePlatform":"Android","catalogChecksum":"8041578763269149377","gameplayCatalog":{"actions":[{"actionStableId":"d7751bee-0c60-4c1a-aedd-f3278bfbf324","callableFingerprint":"14449752960379668282","name":"PlayTone","nameBindingRevision":"1","ownerPackStableId":"4614412951008062639","providerClosureFingerprint":"13074954852448067786"}],"digest":"16799589025869651063","initContentRevision":916588909188382116,"initPackStableId":"8014167674188690335","projectId":"bc73664a-b4d5-464f-ab61-8e084d8f7dae","retired":[],"schema":2},"groups":[],"initPackStableId":"8014167674188690335","language":"","packs":[{"contentHash":"16976931276938721064","contentRevision":916588909188382116,"dependencies":[],"language":"","name":"Init","packKind":2,"packStableId":"8014167674188690335","path":"Init.bytes","platformId":"ce1523ba-ad45-4a5e-8f38-2e708dda8211","variantKey":"0"},{"contentHash":"13918333269424196624","contentRevision":7608669477331152853,"dependencies":["8014167674188690335"],"language":"","name":"PlayTone","packKind":3,"packStableId":"4614412951008062639","path":"PlayTone.bytes","platformId":"ce1523ba-ad45-4a5e-8f38-2e708dda8211","variantKey":"2009869487"}],"platformId":"ce1523ba-ad45-4a5e-8f38-2e708dda8211","platformName":"Android_Low","schema_version":3,"variableCatalog":{"schemaVersion":3,"projectBuildId":0,"executionCatalogFingerprint":2859494785881168858,"sdkCatalogFingerprint":4694109132088536712,"variables":[],"capacity":{"definitionCount":0,"maxReferencedPerContentPack":0,"maxVariableBindings":0,"maxStaticEmitterOverrides":0,"recommendedMaxEmitters":0,"recommendedEmitterVariableSlots":0,"recommendedPendingRows":0,"reserved":0}}}