{"basePlatform":"Windows","catalogChecksum":"7235076408546686847","gameplayCatalog":{"actions":[{"actionStableId":"89933719-7712-4567-b5ec-9e7181de0031","callableFingerprint":"2799545899608068808","name":"Play_Spatial_Delayed","nameBindingRevision":"1","ownerPackStableId":"3270432834610648413","providerClosureFingerprint":"7637727713528642333"},{"actionStableId":"545223e2-4d32-4744-92f1-47349d986874","callableFingerprint":"3008223048784226776","name":"Play_U4_A","nameBindingRevision":"1","ownerPackStableId":"15553800728864637621","providerClosureFingerprint":"5134472409057861274"},{"actionStableId":"53c71da9-0303-40ab-953b-8776b342d854","callableFingerprint":"16474503542169363256","name":"Play_U4_B","nameBindingRevision":"1","ownerPackStableId":"2248104811879414719","providerClosureFingerprint":"4547731820549564372"},{"actionStableId":"4a9597b6-6ba6-4c67-b5b0-37c33f4b96b9","callableFingerprint":"11199964361874815535","name":"Play_U4_Caller","nameBindingRevision":"1","ownerPackStableId":"7217393553551384782","providerClosureFingerprint":"2594827244141715769"}],"digest":"16284658437029842438","initContentRevision":8958694484336581619,"initPackStableId":"4001757327576816915","projectId":"4d65428a-4a32-44d3-a6dd-bf0804b54b7b","retired":[],"schema":2},"groups":[],"initPackStableId":"4001757327576816915","language":"","packs":[{"contentHash":"12288494617094629383","contentRevision":8958694484336581619,"dependencies":[],"language":"","name":"Init","packKind":2,"packStableId":"4001757327576816915","path":"Init.bytes","platformId":"c8e29266-defb-4f42-a138-81c3821b9313","variantKey":"0"},{"contentHash":"16787302230628222588","contentRevision":7142356583220243649,"dependencies":["4001757327576816915"],"language":"","name":"Play_U4_B","packKind":3,"packStableId":"2248104811879414719","path":"Play_U4_B.bytes","platformId":"c8e29266-defb-4f42-a138-81c3821b9313","variantKey":"1508588479"},{"contentHash":"5424210845043273772","contentRevision":3486840212553313409,"dependencies":["4001757327576816915"],"language":"","name":"Play_Spatial_Delayed","packKind":3,"packStableId":"3270432834610648413","path":"Play_Spatial_Delayed.bytes","platformId":"c8e29266-defb-4f42-a138-81c3821b9313","variantKey":"3904755037"},{"contentHash":"11168329387348345662","contentRevision":7587435606398165397,"dependencies":["4001757327576816915","2248104811879414719"],"language":"","name":"Play_U4_Caller","packKind":3,"packStableId":"7217393553551384782","path":"Play_U4_Caller.bytes","platformId":"c8e29266-defb-4f42-a138-81c3821b9313","variantKey":"2476728526"},{"contentHash":"6265831151835071548","contentRevision":7359380515154966250,"dependencies":["4001757327576816915"],"language":"","name":"Play_U4_A","packKind":3,"packStableId":"15553800728864637621","path":"Play_U4_A.bytes","platformId":"c8e29266-defb-4f42-a138-81c3821b9313","variantKey":"4147135157"}],"platformId":"c8e29266-defb-4f42-a138-81c3821b9313","platformName":"Windows","schema_version":3,"variableCatalog":{"schemaVersion":3,"projectBuildId":0,"executionCatalogFingerprint":2859494785881168858,"sdkCatalogFingerprint":4694109132088536712,"variables":[],"capacity":{"definitionCount":0,"maxReferencedPerContentPack":0,"maxVariableBindings":0,"maxStaticEmitterOverrides":0,"recommendedMaxEmitters":0,"recommendedEmitterVariableSlots":0,"recommendedPendingRows":0,"reserved":0}}}