{"basePlatform":"Windows","catalogChecksum":"7064420049885903695","gameplayCatalog":{"actions":[{"actionStableId":"7bdbd44b-0448-463b-bab1-548be3a46338","callableFingerprint":"17960829905745676424","name":"Play_U4_A","nameBindingRevision":"1","ownerPackStableId":"3077852704217042342","providerClosureFingerprint":"12176613035907459803"},{"actionStableId":"f127a52f-451d-4a7c-8bca-a447184093fe","callableFingerprint":"14268661934557253778","name":"Play_U4_B","nameBindingRevision":"1","ownerPackStableId":"13239879068723367155","providerClosureFingerprint":"15462925437919051418"},{"actionStableId":"1bf8eaa2-4bc0-4e5b-a4b2-3e24d113d356","callableFingerprint":"5396944242376266973","name":"Play_U4_Caller","nameBindingRevision":"1","ownerPackStableId":"18293054377292685941","providerClosureFingerprint":"4094004370072118216"}],"digest":"3846533326421433141","initContentRevision":1243027583079563902,"initPackStableId":"6280387348332624753","projectId":"c6da935c-6e74-44d2-bd59-2c07209c4b25","retired":[],"schema":2},"groups":[],"initPackStableId":"6280387348332624753","language":"","packs":[{"contentHash":"9501789337344435208","contentRevision":1243027583079563902,"dependencies":[],"language":"","name":"Init","packKind":2,"packStableId":"6280387348332624753","path":"Init.bytes","platformId":"19fef7ff-e907-490c-b6f2-ebca66627a67","variantKey":"0"},{"contentHash":"10453211375900783836","contentRevision":3583106688268338098,"dependencies":["6280387348332624753"],"language":"","name":"Play_U4_A","packKind":3,"packStableId":"3077852704217042342","path":"Play_U4_A.bytes","platformId":"19fef7ff-e907-490c-b6f2-ebca66627a67","variantKey":"836046246"},{"contentHash":"6097172150966683907","contentRevision":2194978592057533879,"dependencies":["6280387348332624753"],"language":"","name":"Play_U4_B","packKind":3,"packStableId":"13239879068723367155","path":"Play_U4_B.bytes","platformId":"19fef7ff-e907-490c-b6f2-ebca66627a67","variantKey":"2019740915"},{"contentHash":"1184647608375124449","contentRevision":8018419746831006473,"dependencies":["6280387348332624753","13239879068723367155"],"language":"","name":"Play_U4_Caller","packKind":3,"packStableId":"18293054377292685941","path":"Play_U4_Caller.bytes","platformId":"19fef7ff-e907-490c-b6f2-ebca66627a67","variantKey":"258957941"}],"platformId":"19fef7ff-e907-490c-b6f2-ebca66627a67","platformName":"Windows","schema_version":3,"variableCatalog":{"schemaVersion":3,"projectBuildId":0,"executionCatalogFingerprint":2859494785881168858,"sdkCatalogFingerprint":4694109132088536712,"variables":[],"capacity":{"definitionCount":0,"maxReferencedPerContentPack":0,"maxVariableBindings":0,"maxStaticEmitterOverrides":0,"recommendedMaxEmitters":0,"recommendedEmitterVariableSlots":0,"recommendedPendingRows":0,"reserved":0}}}